{
  "schema_version": 1,
  "release_id": "X6_R0_4_F1_RUNTIME_PARAMETER_FREEZE",
  "topology": {
    "context_id": "X6_TOP_01_CONTROLLED_PERFORMANCE_PATH",
    "topology_id": "X6_R1_TOP_01_FIVE_NODE_LINUX_PATH",
    "file": "labs/topologies/x6_r1_packet_loss/topology.clab.yml",
    "sha256": "fcc443147130bb3368ebed67048dc4cd41dc68c3dbea8ad06d3a56b06d06662e",
    "containerlab_name": "x6r1",
    "nodes": [
      {"name": "hosta", "role": "traffic_source", "kind": "linux", "image": "ind-linux:0.1"},
      {"name": "r1", "role": "source_router", "kind": "linux", "image": "ind-linux:0.1"},
      {"name": "r2", "role": "mutation_router", "kind": "linux", "image": "ind-linux:0.1"},
      {"name": "r3", "role": "destination_router", "kind": "linux", "image": "ind-linux:0.1"},
      {"name": "hostb", "role": "traffic_destination", "kind": "linux", "image": "ind-linux:0.1"}
    ],
    "links": [
      {"a": "hosta:eth1", "b": "r1:eth1", "prefix": "10.61.1.0/30", "addresses": {"hosta:eth1": "10.61.1.2/30", "r1:eth1": "10.61.1.1/30"}},
      {"a": "r1:eth2", "b": "r2:eth1", "prefix": "10.61.12.0/30", "addresses": {"r1:eth2": "10.61.12.1/30", "r2:eth1": "10.61.12.2/30"}},
      {"a": "r2:eth2", "b": "r3:eth1", "prefix": "10.61.23.0/30", "addresses": {"r2:eth2": "10.61.23.1/30", "r3:eth1": "10.61.23.2/30"}},
      {"a": "r3:eth2", "b": "hostb:eth1", "prefix": "10.61.3.0/30", "addresses": {"r3:eth2": "10.61.3.1/30", "hostb:eth1": "10.61.3.2/30"}}
    ],
    "forwarding_nodes": ["r1", "r2", "r3"],
    "routes": [
      {"node": "hosta", "destination": "default", "via": "10.61.1.1"},
      {"node": "r1", "destination": "10.61.23.0/30", "via": "10.61.12.2"},
      {"node": "r1", "destination": "10.61.3.0/30", "via": "10.61.12.2"},
      {"node": "r2", "destination": "10.61.1.0/30", "via": "10.61.12.1"},
      {"node": "r2", "destination": "10.61.3.0/30", "via": "10.61.23.2"},
      {"node": "r3", "destination": "10.61.12.0/30", "via": "10.61.23.1"},
      {"node": "r3", "destination": "10.61.1.0/30", "via": "10.61.23.1"},
      {"node": "hostb", "destination": "default", "via": "10.61.3.1"}
    ],
    "source": {"node": "hosta", "container": "clab-x6r1-hosta", "interface": "eth1", "address": "10.61.1.2"},
    "destination": {"node": "hostb", "container": "clab-x6r1-hostb", "interface": "eth1", "address": "10.61.3.2"},
    "mutation_owner": {"node": "r2", "container": "clab-x6r1-r2", "interface": "eth2", "peer": "r3:eth1", "direction": "hosta_to_hostb"},
    "observation_interfaces": [
      {"node": "r2", "container": "clab-x6r1-r2", "interface": "eth2", "counter": "tx_bytes", "direction": "hosta_to_hostb"},
      {"node": "r3", "container": "clab-x6r1-r3", "interface": "eth1", "counter": "rx_bytes", "direction": "hosta_to_hostb", "role": "cross_check"}
    ],
    "healthy_exclusions": {"finite_f3_bottleneck": false, "f4_rate_limiter": false, "competing_traffic": false}
  },
  "image": {
    "tag": "ind-linux:0.1",
    "dockerfile": "labs/images/ind-linux/Dockerfile",
    "dockerfile_sha256": "ca5b97b08895081726b12c1311be050a18f0a1039aa168319ef1420e89761b0c",
    "build_command": ["docker", "build", "--pull=false", "--tag", "ind-linux:0.1", "labs/images/ind-linux"],
    "identity_command": ["docker", "image", "inspect", "ind-linux:0.1"],
    "identity_policy": "record image Id and RepoDigests before deployment; source tag plus Dockerfile hash is not a runtime digest claim; unavailable identity fails before official deployment"
  },
  "traffic": {
    "direction": "hosta_to_hostb",
    "destination_address": "10.61.3.2",
    "iperf3_port": 5201,
    "transport": "TCP",
    "streams": 1,
    "duration_seconds": 20,
    "server_command": ["docker", "exec", "-d", "clab-x6r1-hostb", "/bin/sh", "-c", "exec /usr/bin/iperf3 -s --one-off -p 5201 --json >/tmp/x6-r1-iperf-server.json 2>&1"],
    "server_readiness_command": ["docker", "exec", "clab-x6r1-hostb", "/usr/bin/ss", "-H", "-ltn", "sport", "=", ":5201"],
    "server_output_command": ["docker", "exec", "clab-x6r1-hostb", "/usr/bin/cat", "/tmp/x6-r1-iperf-server.json"],
    "server_teardown_command": ["docker", "exec", "clab-x6r1-hostb", "/usr/bin/pkill", "-x", "iperf3"],
    "client_command": ["docker", "exec", "clab-x6r1-hosta", "/usr/bin/iperf3", "-c", "10.61.3.2", "-t", "20", "-P", "1", "-p", "5201", "-J"],
    "ping_command": ["docker", "exec", "--env", "LC_ALL=C", "clab-x6r1-hosta", "/usr/bin/ping", "-n", "-i", "0.2", "-c", "50", "-W", "1", "-s", "56", "10.61.3.2"],
    "version_commands": [
      ["docker", "exec", "clab-x6r1-hosta", "/usr/bin/ping", "-V"],
      ["docker", "exec", "clab-x6r1-hosta", "/usr/bin/iperf3", "--version"],
      ["docker", "exec", "clab-x6r1-r2", "/usr/sbin/tc", "-V"],
      ["docker", "exec", "clab-x6r1-r2", "/usr/bin/uname", "-r"]
    ],
    "timeouts_seconds": {"server_start": 5, "server_readiness": 5, "client": 25, "ping": 16, "server_output": 5, "server_teardown": 5, "counter": 5, "qdisc": 10},
    "server_retry_policy": "no completed-window retry; readiness polls every 0.1 seconds for at most 5 seconds before the window starts; teardown precedes the next window"
  },
  "qdisc": {
    "pre_state": {"kind": "noqueue", "handle": "0:", "parent": "root", "children": [], "policy": "exactly one root noqueue record; any other qdisc or any filter fails before recovery intent or mutation"},
    "capture_command": ["docker", "exec", "clab-x6r1-r2", "/usr/sbin/tc", "-j", "-s", "qdisc", "show", "dev", "eth2"],
    "filter_commands": [
      ["docker", "exec", "clab-x6r1-r2", "/usr/sbin/tc", "-j", "filter", "show", "dev", "eth2", "root"],
      ["docker", "exec", "clab-x6r1-r2", "/usr/sbin/tc", "-j", "filter", "show", "dev", "eth2", "ingress"]
    ],
    "tc_binary": "/usr/sbin/tc",
    "loss_model": "netem_random_independent_zero_correlation",
    "loss_percent": "10.000000",
    "correlation_percent": "0.000000",
    "seed": null,
    "seed_policy": "iproute2 in ind-linux:0.1 has no frozen portable deterministic NetEm seed contract; record tc/kernel versions and accept stochastic placement only within the predeclared binomial bound; never claim reproducible packet positions",
    "netem": {"kind": "netem", "handle": "10:", "parent": "root", "limit_packets": 1000},
    "pfifo": {"kind": "pfifo", "handle": "20:", "parent": "10:1", "limit_packets": 1000, "feature_owner": "queue_drop_count"},
    "forward_commands": [
      ["docker", "exec", "clab-x6r1-r2", "/usr/sbin/tc", "qdisc", "replace", "dev", "eth2", "root", "handle", "10:", "netem", "limit", "1000", "loss", "random", "10%", "0%"],
      ["docker", "exec", "clab-x6r1-r2", "/usr/sbin/tc", "qdisc", "replace", "dev", "eth2", "parent", "10:1", "handle", "20:", "pfifo", "limit", "1000"]
    ],
    "recovery_command": ["docker", "exec", "clab-x6r1-r2", "/usr/sbin/tc", "qdisc", "del", "dev", "eth2", "root"],
    "state_machine": ["PLANNED", "ATTEMPTED", "COMMAND_ACCEPTED", "MUTATION_EFFECTIVE", "RESTORATION_CONFIRMED"],
    "journal_policy": "write recovery intent and PLANNED action atomically before first forward command; record ATTEMPTED before each command and acceptance afterward",
    "partial_states": [
      {"name": "root_only", "accepted": {"root": "netem 10:", "children": []}, "recovery": "delete root 10: then verify exact noqueue 0:"},
      {"name": "root_and_child", "accepted": {"root": "netem 10:", "children": ["pfifo 20: parent 10:1"]}, "recovery": "delete root 10: recursively then verify exact noqueue 0:"}
    ],
    "idempotent_recovery": "inspect first: exact noqueue 0: is already restored; only netem 10: with optional pfifo 20: may be deleted; all other states fail closed; inspect again and require exact noqueue 0: with no filters",
    "standalone_recovery_inputs": ["runtime_context_sha256", "topology_sha256", "node", "interface", "approved_handles", "durable_action_status"],
    "command_timeout_seconds": 10
  },
  "windows": {
    "warm_up": {"count": 1, "duration_seconds": 5, "accepted_measurement": false, "purpose": "route, neighbor and tool readiness only"},
    "baseline": {"count": 10, "accepted_measurement": true},
    "fault": {"count": 3, "accepted_measurement": true, "justification": "150 frozen ping trials reduce loss-sampling variability without selecting results"},
    "restoration": {"count": 3, "accepted_measurement": true, "justification": "same fixed count as fault windows; every window must satisfy baseline thresholds"},
    "timeline": [
      {"offset_seconds": "0.000", "action": "capture initial interface and qdisc counters"},
      {"offset_seconds": "0.000", "action": "start 20-second iperf3 TCP client after bounded server readiness"},
      {"offset_seconds": "5.000", "action": "start 50-packet ping probe"},
      {"offset_seconds": "20.000_or_bounded_completion", "action": "wait for both commands, then capture final counters and qdisc state"}
    ],
    "allowed_start_skew_seconds": "0.250",
    "clock": "time.monotonic_ns for ordering/duration plus UTC timestamps for provenance",
    "synchronization": "one controller assigns one immutable window_id, starts client, waits by monotonic deadline until t=5, starts ping, joins both bounded commands, and rejects the whole window if startup skew exceeds 0.250 seconds",
    "failure_policy": "any command, parse, readiness, timeout, skew or counter failure makes the entire window unavailable; no selective feature/window retry"
  },
  "features": [
    {"feature_id": "packet_loss_ratio", "value_type": "number", "unit": "ratio", "source": "hosta ping stdout summary plus individual replies", "per_window": "(50-received)/50 after X6-R0.3 validation", "fault_aggregation": "total losses divided by 150 across exactly three valid windows", "unavailable": "any ping chain invalid or any fault window unavailable"},